{"bbox":[-105.6,39.95,-105.1,40.05],"generated_at":"2026-09-06T06:00:00Z","geometry_url":"https://data.bioregionaltwin.org/geom/watershed/huc12-101900050702.geojson","huc12":"101900050702","id":"watershed/huc12-101900050702","kind":"watershed","latest_url":"https://data.bioregionaltwin.org/latest/watershed/huc12-101900050702.json","name":"Dry Creek Number 2","schema_version":"1.0","sensitivity":"public","twin_url":"https://bioregionaltwin.org/front-range/twin?focus=watershed/huc12-101900050702"}
