{"bbox":[-105.59,39.94,-105.59,39.94],"generated_at":"2026-09-06T06:00:00Z","geometry_url":"https://data.bioregionaltwin.org/geom/place/lake-eldora.geojson","huc12":"101900050402","id":"place/lake-eldora","kind":"monitoring_site","latest_url":"https://data.bioregionaltwin.org/latest/place/lake-eldora.json","name":"Lake Eldora","schema_version":"1.0","sensitivity":"public","twin_url":"https://bioregionaltwin.org/front-range/twin?focus=place/lake-eldora"}
