{"bbox":[-105.1,39.97,-105.06,40.15],"commons_url":"https://prism.omniharmonic.com/p/front-range/notes/wiki%2Fplaces%2Fwatersheds%2Fhuc101900050704","generated_at":"2026-09-06T05:00:00Z","geometry_url":"https://data.bioregionaltwin.org/geom/watershed/huc12-101900050704.geojson","huc12":"101900050704","id":"watershed/huc12-101900050704","kind":"watershed","latest_url":"https://data.bioregionaltwin.org/latest/watershed/huc12-101900050704.json","name":"Lower Lower Boulder Creek","schema_version":"1.0","sensitivity":"public","twin_url":"https://bioregionaltwin.org/front-range/twin?focus=watershed/huc12-101900050704"}
