{"bbox":[-105.177371,40.051443,-105.177371,40.051443],"generated_at":"2026-09-06T05:00:00Z","geometry_url":"https://data.bioregionaltwin.org/geom/place/city-of-boulder-effluent-release-to-boulder-creek.geojson","huc12":"101900050702","id":"place/city-of-boulder-effluent-release-to-boulder-creek","kind":"monitoring_site","latest_url":"https://data.bioregionaltwin.org/latest/place/city-of-boulder-effluent-release-to-boulder-creek.json","name":"City Of Boulder Effluent Release To Boulder Creek","schema_version":"1.0","sensitivity":"public","twin_url":"https://bioregionaltwin.org/front-range/twin?focus=place/city-of-boulder-effluent-release-to-boulder-creek"}
