{"bbox":[-105.144265,40.047775,-105.144265,40.047775],"generated_at":"2026-09-06T05:00:00Z","geometry_url":"https://data.bioregionaltwin.org/geom/place/dry-creek-carrier-ditch-above-boulder-creek-confluence.geojson","huc12":"101900050702","id":"place/dry-creek-carrier-ditch-above-boulder-creek-confluence","kind":"monitoring_site","latest_url":"https://data.bioregionaltwin.org/latest/place/dry-creek-carrier-ditch-above-boulder-creek-confluence.json","name":"Dry Creek Carrier Ditch Above Boulder Creek Confluence","schema_version":"1.0","sensitivity":"public","twin_url":"https://bioregionaltwin.org/front-range/twin?focus=place/dry-creek-carrier-ditch-above-boulder-creek-confluence"}
