{"bbox":[-105.25762,40.011052,-105.25762,40.011052],"generated_at":"2026-09-06T05:00:00Z","geometry_url":"https://data.bioregionaltwin.org/geom/place/boulder-creek-below-wellman-ditch.geojson","huc12":"101900050606","id":"place/boulder-creek-below-wellman-ditch","kind":"monitoring_site","latest_url":"https://data.bioregionaltwin.org/latest/place/boulder-creek-below-wellman-ditch.json","name":"Boulder Creek Below Wellman Ditch","schema_version":"1.0","sensitivity":"public","twin_url":"https://bioregionaltwin.org/front-range/twin?focus=place/boulder-creek-below-wellman-ditch"}
