{"bbox":[-105.7,39.9,-105,40.1],"generated_at":"2026-09-06T06:00:00Z","geometry_url":"https://data.bioregionaltwin.org/geom/watershed/huc10-1019000505.geojson","id":"watershed/huc10-1019000505","kind":"watershed","latest_url":"https://data.bioregionaltwin.org/latest/watershed/huc10-1019000505.json","name":"South Boulder Creek","schema_version":"1.0","sensitivity":"public","twin_url":"https://bioregionaltwin.org/front-range/twin?focus=watershed/huc10-1019000505"}
