{"bbox":[-105.097882,40.059815,-105.097882,40.059815],"generated_at":"2026-09-06T05:00:00Z","geometry_url":"https://data.bioregionaltwin.org/geom/place/boulder-creek-at-109-st-near-erie-co.geojson","huc12":"101900050704","id":"place/boulder-creek-at-109-st-near-erie-co","kind":"monitoring_site","latest_url":"https://data.bioregionaltwin.org/latest/place/boulder-creek-at-109-st-near-erie-co.json","name":"Boulder Creek At 109 St Near Erie, Co","schema_version":"1.0","sensitivity":"public","twin_url":"https://bioregionaltwin.org/front-range/twin?focus=place/boulder-creek-at-109-st-near-erie-co"}
