{"bbox":[-105.151148,40.053667,-105.151148,40.053667],"generated_at":"2026-09-06T05:00:00Z","geometry_url":"https://data.bioregionaltwin.org/geom/place/leggett-ditch.geojson","huc12":"101900050702","id":"place/leggett-ditch","kind":"monitoring_site","latest_url":"https://data.bioregionaltwin.org/latest/place/leggett-ditch.json","name":"Leggett Ditch","schema_version":"1.0","sensitivity":"public","twin_url":"https://bioregionaltwin.org/front-range/twin?focus=place/leggett-ditch"}
