{"bbox":[-105.330825,40.006375,-105.330825,40.006375],"commons_url":"https://prism.omniharmonic.com/p/front-range/notes/wiki%2Fplaces%2Fmonitoring%2Fboulder-creek-near-orodell-co","generated_at":"2026-09-06T05:00:00Z","geometry_url":"https://data.bioregionaltwin.org/geom/place/boulder-creek-near-orodell-co.geojson","huc12":"101900050604","id":"place/boulder-creek-near-orodell-co","kind":"monitoring_site","latest_url":"https://data.bioregionaltwin.org/latest/place/boulder-creek-near-orodell-co.json","name":"BOULDER CREEK NEAR ORODELL, CO.","sameAs":["https://dwr.state.co.us/Tools/Stations/BOCOROCO","https://waterdata.usgs.gov/monitoring-location/06727500"],"schema_version":"1.0","sensitivity":"public","twin_url":"https://bioregionaltwin.org/front-range/twin?focus=place/boulder-creek-near-orodell-co"}
