{"bbox":[-105.308667,39.932444,-105.308667,39.932444],"commons_url":"https://prism.omniharmonic.com/p/front-range/notes/wiki%2Fplaces%2Fmonitoring%2Fsouth-boulder-cr-at-forebay-nr-eldorado-springs-co","generated_at":"2026-09-06T05:00:00Z","geometry_url":"https://data.bioregionaltwin.org/geom/place/south-boulder-cr-at-forebay-nr-eldorado-springs-co.geojson","huc12":"101900050504","id":"place/south-boulder-cr-at-forebay-nr-eldorado-springs-co","kind":"monitoring_site","latest_url":"https://data.bioregionaltwin.org/latest/place/south-boulder-cr-at-forebay-nr-eldorado-springs-co.json","name":"SOUTH BOULDER CR AT FOREBAY NR ELDORADO SPRINGS CO","schema_version":"1.0","sensitivity":"public","twin_url":"https://bioregionaltwin.org/front-range/twin?focus=place/south-boulder-cr-at-forebay-nr-eldorado-springs-co"}
