{"bbox":[-105.347953,39.938324,-105.347953,39.938324],"generated_at":"2026-09-06T05:00:00Z","geometry_url":"https://data.bioregionaltwin.org/geom/place/south-boulder-creek-below-gross-reservoir.geojson","huc12":"101900050503","id":"place/south-boulder-creek-below-gross-reservoir","kind":"monitoring_site","latest_url":"https://data.bioregionaltwin.org/latest/place/south-boulder-creek-below-gross-reservoir.json","name":"South Boulder Creek Below Gross Reservoir","schema_version":"1.0","sensitivity":"public","twin_url":"https://bioregionaltwin.org/front-range/twin?focus=place/south-boulder-creek-below-gross-reservoir"}
