{"bbox":[-105.220564,39.986802,-105.220564,39.986802],"generated_at":"2026-09-06T05:00:00Z","geometry_url":"https://data.bioregionaltwin.org/geom/place/south-boulder-creek-above-howard-ditch.geojson","huc12":"101900050606","id":"place/south-boulder-creek-above-howard-ditch","kind":"monitoring_site","latest_url":"https://data.bioregionaltwin.org/latest/place/south-boulder-creek-above-howard-ditch.json","name":"South Boulder Creek Above Howard Ditch","schema_version":"1.0","sensitivity":"public","twin_url":"https://bioregionaltwin.org/front-range/twin?focus=place/south-boulder-creek-above-howard-ditch"}
