{"bbox":[-105.020222,40.138778,-105.020222,40.138778],"commons_url":"https://prism.omniharmonic.com/p/front-range/notes/wiki%2Fplaces%2Fmonitoring%2Fboulder-creek-at-mouth-near-longmont-co","generated_at":"2026-09-06T05:00:00Z","geometry_url":"https://data.bioregionaltwin.org/geom/place/boulder-creek-at-mouth-near-longmont-co.geojson","huc12":"101900050705","id":"place/boulder-creek-at-mouth-near-longmont-co","kind":"monitoring_site","latest_url":"https://data.bioregionaltwin.org/latest/place/boulder-creek-at-mouth-near-longmont-co.json","name":"BOULDER CREEK AT MOUTH NEAR LONGMONT, CO","schema_version":"1.0","sensitivity":"public","twin_url":"https://bioregionaltwin.org/front-range/twin?focus=place/boulder-creek-at-mouth-near-longmont-co"}
