{"bbox":[-105.57,40.03,-105.57,40.03],"generated_at":"2026-09-06T06:00:00Z","geometry_url":"https://data.bioregionaltwin.org/geom/place/university-camp-2.geojson","huc12":"101900050401","id":"place/university-camp-2","kind":"monitoring_site","latest_url":"https://data.bioregionaltwin.org/latest/place/university-camp-2.json","name":"University Camp","schema_version":"1.0","sensitivity":"public","twin_url":"https://bioregionaltwin.org/front-range/twin?focus=place/university-camp-2"}
