{"bbox":[-105.301065,40.013218,-105.301065,40.013218],"generated_at":"2026-09-06T05:00:00Z","geometry_url":"https://data.bioregionaltwin.org/geom/place/anderson-ditch.geojson","huc12":"101900050604","id":"place/anderson-ditch","kind":"monitoring_site","latest_url":"https://data.bioregionaltwin.org/latest/place/anderson-ditch.json","name":"Anderson Ditch","schema_version":"1.0","sensitivity":"public","twin_url":"https://bioregionaltwin.org/front-range/twin?focus=place/anderson-ditch"}
