{"bbox":[-105.4003,40.0033,-105.4003,40.0033],"generated_at":"2026-09-06T05:00:00Z","geometry_url":"https://data.bioregionaltwin.org/geom/place/boulder-creek-co-below-nederland.geojson","huc12":"101900050602","id":"place/boulder-creek-co-below-nederland","kind":"monitoring_site","latest_url":"https://data.bioregionaltwin.org/latest/place/boulder-creek-co-below-nederland.json","name":"Boulder Creek (CO) below Nederland","schema_version":"1.0","sensitivity":"public","twin_url":"https://bioregionaltwin.org/front-range/twin?focus=place/boulder-creek-co-below-nederland"}
