{"bbox":[-105.30026,40.022095,-105.30026,40.022095],"generated_at":"2026-09-06T05:00:00Z","geometry_url":"https://data.bioregionaltwin.org/geom/place/silver-lake-ditch.geojson","huc12":"101900050604","id":"place/silver-lake-ditch","kind":"monitoring_site","latest_url":"https://data.bioregionaltwin.org/latest/place/silver-lake-ditch.json","name":"Silver Lake Ditch","schema_version":"1.0","sensitivity":"public","twin_url":"https://bioregionaltwin.org/front-range/twin?focus=place/silver-lake-ditch"}
