{"bbox":[-105.12,40.06,-105.12,40.06],"generated_at":"2026-09-06T06:00:00Z","geometry_url":"https://data.bioregionaltwin.org/geom/place/six-mile-reservoir.geojson","huc12":"101900050702","id":"place/six-mile-reservoir","kind":"monitoring_site","latest_url":"https://data.bioregionaltwin.org/latest/place/six-mile-reservoir.json","name":"SIX MILE RESERVOIR","schema_version":"1.0","sensitivity":"public","twin_url":"https://bioregionaltwin.org/front-range/twin?focus=place/six-mile-reservoir"}
