{"bbox":[-105.3125,40.0225,-105.3125,40.0225],"generated_at":"2026-09-06T05:00:00Z","geometry_url":"https://data.bioregionaltwin.org/geom/place/private-headgate-generalized.geojson","huc12":"101900050604","id":"place/private-headgate-generalized","kind":"monitoring_site","latest_url":"https://data.bioregionaltwin.org/latest/place/private-headgate-generalized.json","name":"Private Headgate (generalized)","schema_version":"1.0","sensitivity":"generalized","twin_url":"https://bioregionaltwin.org/front-range/twin?focus=place/private-headgate-generalized"}
