{"bbox":[-105.504442,39.961654,-105.504442,39.961654],"generated_at":"2026-09-06T05:00:00Z","geometry_url":"https://data.bioregionaltwin.org/geom/place/middle-boulder-creek-at-nederland-co.geojson","huc12":"101900050405","id":"place/middle-boulder-creek-at-nederland-co","kind":"monitoring_site","latest_url":"https://data.bioregionaltwin.org/latest/place/middle-boulder-creek-at-nederland-co.json","name":"MIDDLE BOULDER CREEK AT NEDERLAND, CO.","schema_version":"1.0","sensitivity":"public","twin_url":"https://bioregionaltwin.org/front-range/twin?focus=place/middle-boulder-creek-at-nederland-co"}
