{"bbox":[-105.3308,40.0064,-105.3308,40.0064],"generated_at":"2026-09-06T05:00:00Z","geometry_url":"https://data.bioregionaltwin.org/geom/place/boulder-creek-co-near-orodell.geojson","huc12":"101900050604","id":"place/boulder-creek-co-near-orodell","kind":"monitoring_site","latest_url":"https://data.bioregionaltwin.org/latest/place/boulder-creek-co-near-orodell.json","name":"Boulder Creek (CO) near Orodell","schema_version":"1.0","sensitivity":"public","twin_url":"https://bioregionaltwin.org/front-range/twin?focus=place/boulder-creek-co-near-orodell"}
