{"bbox":[-105.422985,39.931659,-105.422985,39.931659],"generated_at":"2026-09-06T05:00:00Z","geometry_url":"https://data.bioregionaltwin.org/geom/place/south-boulder-creek-above-gross-reservoir-at-pinecliffe.geojson","huc12":"101900050501","id":"place/south-boulder-creek-above-gross-reservoir-at-pinecliffe","kind":"monitoring_site","latest_url":"https://data.bioregionaltwin.org/latest/place/south-boulder-creek-above-gross-reservoir-at-pinecliffe.json","name":"South Boulder Creek Above Gross Reservoir At Pinecliffe","schema_version":"1.0","sensitivity":"public","twin_url":"https://bioregionaltwin.org/front-range/twin?focus=place/south-boulder-creek-above-gross-reservoir-at-pinecliffe"}
